{
  "schema_version": 1,
  "source": "Executive Operator Blueprint 10/10 Addendum sections 21 and Tasks 15-19",
  "claim_scope": "reference-synthetic",
  "scenarios": [
    {
      "id": "C01",
      "requirement": "No evidence cannot pass acceptance",
      "authority": "contracts/evidence-authorities.json",
      "implementation_path": "tools/operator-control/acceptance.py",
      "failure_path": "If tests/test_operator_state.py::test_done_requires_evidence fails, this scenario enters FAIL and acceptance remains blocked.",
      "required": true,
      "expected_state": "reference-synthetic-pass",
      "claim_scope": "reference-synthetic",
      "evidence_test_node_ids": [
        "tests/test_operator_state.py::test_done_requires_evidence"
      ]
    },
    {
      "id": "C02",
      "requirement": "Irrelevant evidence is rejected or inconclusive",
      "authority": "contracts/evidence-authorities.json",
      "implementation_path": "tools/operator-control/acceptance.py",
      "failure_path": "If tests/test_control_final_blockers.py::test_evidence_requires_opened_content_protected_verifier_retention_and_bindings fails, this scenario enters FAIL and acceptance remains blocked.",
      "required": true,
      "expected_state": "reference-synthetic-pass",
      "claim_scope": "reference-synthetic",
      "evidence_test_node_ids": [
        "tests/test_control_final_blockers.py::test_evidence_requires_opened_content_protected_verifier_retention_and_bindings"
      ]
    },
    {
      "id": "C03",
      "requirement": "Partial required criteria leave task open",
      "authority": "contracts/evidence-authorities.json",
      "implementation_path": "tools/operator-control/acceptance.py",
      "failure_path": "If tests/test_task_contracts.py::test_partial_task_stays_open_with_minimal_resume_information fails, this scenario enters FAIL and acceptance remains blocked.",
      "required": true,
      "expected_state": "reference-synthetic-pass",
      "claim_scope": "reference-synthetic",
      "evidence_test_node_ids": [
        "tests/test_task_contracts.py::test_partial_task_stays_open_with_minimal_resume_information"
      ]
    },
    {
      "id": "C04",
      "requirement": "Requirement version change invalidates old evidence",
      "authority": "contracts/evidence-authorities.json",
      "implementation_path": "tools/operator-control/acceptance.py",
      "failure_path": "If tests/test_acceptance_adversarial.py::test_stale_or_wrong_bound_evidence_rejects fails, this scenario enters FAIL and acceptance remains blocked.",
      "required": true,
      "expected_state": "reference-synthetic-pass",
      "claim_scope": "reference-synthetic",
      "evidence_test_node_ids": [
        "tests/test_acceptance_adversarial.py::test_stale_or_wrong_bound_evidence_rejects"
      ]
    },
    {
      "id": "C05",
      "requirement": "Worker cannot weaken protected policy or tests",
      "authority": "contracts/evidence-authorities.json",
      "implementation_path": "tools/operator-control/acceptance.py",
      "failure_path": "If tests/test_acceptance_adversarial.py::test_worker_policy_and_asserted_fake_uri_cannot_authorize fails, this scenario enters FAIL and acceptance remains blocked.",
      "required": true,
      "expected_state": "reference-synthetic-pass",
      "claim_scope": "reference-synthetic",
      "evidence_test_node_ids": [
        "tests/test_acceptance_adversarial.py::test_worker_policy_and_asserted_fake_uri_cannot_authorize"
      ]
    },
    {
      "id": "C06",
      "requirement": "Wrong target or artifact evidence is rejected",
      "authority": "contracts/evidence-authorities.json",
      "implementation_path": "tools/operator-control/acceptance.py",
      "failure_path": "If tests/test_control_boundary_adversarial.py::test_readback_must_bind_every_protected_dimension fails, this scenario enters FAIL and acceptance remains blocked.",
      "required": true,
      "expected_state": "reference-synthetic-pass",
      "claim_scope": "reference-synthetic",
      "evidence_test_node_ids": [
        "tests/test_control_boundary_adversarial.py::test_readback_must_bind_every_protected_dimension"
      ]
    },
    {
      "id": "C07",
      "requirement": "Inaccessible verifier source does not pass",
      "authority": "contracts/evidence-authorities.json",
      "implementation_path": "tools/operator-control/acceptance.py",
      "failure_path": "If tests/test_integration_contracts.py::test_authority_rejects_unavailable_fetch_redirect_and_fake_assertions fails, this scenario enters FAIL and acceptance remains blocked.",
      "required": true,
      "expected_state": "reference-synthetic-pass",
      "claim_scope": "reference-synthetic",
      "evidence_test_node_ids": [
        "tests/test_integration_contracts.py::test_authority_rejects_unavailable_fetch_redirect_and_fake_assertions"
      ]
    },
    {
      "id": "C08",
      "requirement": "Verifier crash leaves work unaccepted and recorded",
      "authority": "contracts/evidence-authorities.json",
      "implementation_path": "tools/operator-control/acceptance.py",
      "failure_path": "If tests/test_control_boundary_adversarial.py::test_every_provider_exception_persists_unknown_and_can_be_boundedly_reconciled fails, this scenario enters FAIL and acceptance remains blocked.",
      "required": true,
      "expected_state": "reference-synthetic-pass",
      "claim_scope": "reference-synthetic",
      "evidence_test_node_ids": [
        "tests/test_control_boundary_adversarial.py::test_every_provider_exception_persists_unknown_and_can_be_boundedly_reconciled"
      ]
    },
    {
      "id": "C09",
      "requirement": "Verifier disagreement requires stronger resolution",
      "authority": "contracts/evidence-authorities.json",
      "implementation_path": "tools/operator-control/acceptance.py",
      "failure_path": "If tests/test_acceptance_adversarial.py::test_signed_bound_review_and_three_way_separation_required fails, this scenario enters FAIL and acceptance remains blocked.",
      "required": true,
      "expected_state": "reference-synthetic-pass",
      "claim_scope": "reference-synthetic",
      "evidence_test_node_ids": [
        "tests/test_acceptance_adversarial.py::test_signed_bound_review_and_three_way_separation_required"
      ]
    },
    {
      "id": "C10",
      "requirement": "Unsupported citation fails source-to-claim review",
      "authority": "contracts/evidence-authorities.json",
      "implementation_path": "tools/operator-control/acceptance.py",
      "failure_path": "If tests/test_integration_contracts.py::test_semantic_registry_review_rejects_superficial_evidence[license-unknown] fails, this scenario enters FAIL and acceptance remains blocked.",
      "required": true,
      "expected_state": "reference-synthetic-pass",
      "claim_scope": "reference-synthetic",
      "evidence_test_node_ids": [
        "tests/test_integration_contracts.py::test_semantic_registry_review_rejects_superficial_evidence[license-unknown]"
      ]
    },
    {
      "id": "C11",
      "requirement": "Untrusted email document web tool and worker instructions cannot change controls",
      "authority": "contracts/enforcement-coverage.yaml",
      "implementation_path": "tools/operator-control/broker.py",
      "failure_path": "If tests/test_action_boundary.py::test_untrusted_content_cannot_supply_control_fields fails, this scenario enters FAIL and acceptance remains blocked.",
      "required": true,
      "expected_state": "reference-synthetic-pass",
      "claim_scope": "reference-synthetic",
      "evidence_test_node_ids": [
        "tests/test_action_boundary.py::test_untrusted_content_cannot_supply_control_fields"
      ]
    },
    {
      "id": "C12",
      "requirement": "Repair regression prevents acceptance",
      "authority": "contracts/enforcement-coverage.yaml",
      "implementation_path": "tools/operator-control/broker.py",
      "failure_path": "If tests/test_orchestration_edges.py::test_parent_needs_integrated_acceptance_for_incompatible_children_and_merge_regression fails, this scenario enters FAIL and acceptance remains blocked.",
      "required": true,
      "expected_state": "reference-synthetic-pass",
      "claim_scope": "reference-synthetic",
      "evidence_test_node_ids": [
        "tests/test_orchestration_edges.py::test_parent_needs_integrated_acceptance_for_incompatible_children_and_merge_regression"
      ]
    },
    {
      "id": "C13",
      "requirement": "Repeated repair respects shared retry limit",
      "authority": "contracts/enforcement-coverage.yaml",
      "implementation_path": "tools/operator-control/broker.py",
      "failure_path": "If tests/test_website_reliability_contract.py::test_failed_bounded_repair_escalates_but_routine_success_is_quiet fails, this scenario enters FAIL and acceptance remains blocked.",
      "required": true,
      "expected_state": "reference-synthetic-pass",
      "claim_scope": "reference-synthetic",
      "evidence_test_node_ids": [
        "tests/test_website_reliability_contract.py::test_failed_bounded_repair_escalates_but_routine_success_is_quiet"
      ]
    },
    {
      "id": "C14",
      "requirement": "Reassignment preserves budget deadline and repair history",
      "authority": "contracts/enforcement-coverage.yaml",
      "implementation_path": "tools/operator-control/broker.py",
      "failure_path": "If tests/test_orchestration_edges.py::test_reassignment_preserves_total_budget_deadline_and_repair_history fails, this scenario enters FAIL and acceptance remains blocked.",
      "required": true,
      "expected_state": "reference-synthetic-pass",
      "claim_scope": "reference-synthetic",
      "evidence_test_node_ids": [
        "tests/test_orchestration_edges.py::test_reassignment_preserves_total_budget_deadline_and_repair_history"
      ]
    },
    {
      "id": "C15",